{
  "$schema": "https://json-schema.org/draft/2020-12/schema",
  "$id": "https://prodqc.example/schema/shared-check.json",
  "title": "SharedCheck",
  "description": "Generic check that may leave a lab. assay + rule + reason only; no protocol text or raw data.",
  "type": "object",
  "additionalProperties": false,
  "required": ["id", "assay", "rule", "reason", "library_version"],
  "properties": {
    "id": {
      "type": "string",
      "minLength": 1,
      "pattern": "^[a-z0-9]+(-[a-z0-9]+)*$",
      "description": "Stable check id, kebab-case."
    },
    "assay": {
      "type": "string",
      "minLength": 1,
      "description": "Assay type key, e.g. ribogreen-ee. Must match checks/<assay>.md."
    },
    "rule": {
      "type": "string",
      "minLength": 1,
      "description": "What to flag (the detection rule)."
    },
    "reason": {
      "type": "string",
      "minLength": 1,
      "description": "Why the rule exists scientifically, still generic."
    },
    "library_version": {
      "type": "string",
      "pattern": "^[0-9]+\\.[0-9]+\\.[0-9]+$",
      "description": "Semver of checks/<assay>.md when this rule was published."
    }
  }
}
