{
  "id": "ee-formula-error",
  "assay": "ribogreen-ee",
  "rule": "Flag total/free (inverted) and free/total without 1 − (leak fraction, mislabelled) with distinct messages.",
  "reason": "Those two expressions are different errors: one inverts free and total; the other reports leak as EE.",
  "library_version": "0.3.0"
}
